{
  "id": "conv_01hz3xcz88",
  "scope": { "level": "workspace", "id": "workspace_9f2a1c" },
  "initiatingPrincipal": { "kind": "user", "id": "user_3b7c9d" },
  "currentSessionId": "sess_01hz3xf012",
  "pinnedAgentVersion": { "agentDefinitionId": "agentdef_01hz3x9k2v", "version": 6 },
  "previousSessionIds": ["sess_01hz3wab90", "sess_01hz3wcd12"]
}
